"full_name","description","html_url","language","stargazers_count","forks_count","created_at","updated_at"
"Cobalt-Strike/sleep_python_bridge","This project is 'bridge' between the sleep and python language. It allows the control of a Cobalt Strike teamserver through python without the need for for the standard GUI client.   NOTE: This project is very much in BETA. The goal is to provide a playground for testing and is in no way an officially support feature. Perhaps this could be something added in the future to the core product.","https://github.com/Cobalt-Strike/sleep_python_bridge","Python","184","32","2021-10-12T18:18:48Z","2025-04-16T05:03:03Z"
"Cobalt-Strike/CallStackMasker","A PoC implementation for dynamically masking call stacks with timers.","https://github.com/Cobalt-Strike/CallStackMasker","C++","274","35","2023-02-02T17:30:12Z","2025-04-24T03:59:15Z"
"rsmudge/unhook-bof","Remove API hooks from a Beacon process.","https://github.com/rsmudge/unhook-bof","C","269","59","2021-01-13T02:20:44Z","2025-05-16T08:18:07Z"
"rsmudge/metasploit-loader","A client compatible with Metasploit's staging protocol","https://github.com/rsmudge/metasploit-loader","C","256","89","2012-09-13T02:56:11Z","2025-05-07T03:41:16Z"
"rsmudge/CVE-2020-0796-BOF",,"https://github.com/rsmudge/CVE-2020-0796-BOF","C","70","20","2020-09-17T01:48:37Z","2025-01-06T01:01:06Z"
"G0ldenGunSec/GetWebDAVStatus","Determine if the WebClient Service (WebDAV) is running on a remote system","https://github.com/G0ldenGunSec/GetWebDAVStatus","C","137","27","2021-09-29T17:31:21Z","2025-04-29T08:12:20Z"
"cube0x0/KrbRelay","Framework for Kerberos relaying ","https://github.com/cube0x0/KrbRelay","C#","912","128","2022-02-14T08:21:57Z","2025-05-17T16:24:08Z"
"xl7dev/WebShell","Webshell && Backdoor Collection","https://github.com/xl7dev/WebShell","PHP","1887","1039","2015-10-16T20:56:15Z","2025-05-11T02:16:48Z"
"SecWiki/WebShell-2","Webshell","https://github.com/SecWiki/WebShell-2","PHP","145","134","2016-12-01T07:43:45Z","2025-05-07T06:24:59Z"
"fatedier/frp","A fast reverse proxy to help you expose a local server behind a NAT or firewall to the internet.","https://github.com/fatedier/frp","Go","94007","14030","2015-12-21T15:24:59Z","2025-05-18T11:54:18Z"
"JSCU-NL/COATHANGER","IOCs and detection script for COATHANGER malware","https://github.com/JSCU-NL/COATHANGER","Python","54","9","2024-02-06T08:42:18Z","2025-04-11T11:52:21Z"
"j00ru/windows-syscalls","Windows System Call Tables (NT/2000/XP/2003/Vista/7/8/10/11)","https://github.com/j00ru/windows-syscalls","HTML","2321","344","2018-05-31T07:41:52Z","2025-05-18T06:50:29Z"
"thefLink/Hunt-Sleeping-Beacons","Aims to identify sleeping beacons","https://github.com/thefLink/Hunt-Sleeping-Beacons","C","590","55","2022-01-07T17:03:44Z","2025-05-17T22:06:23Z"
"theY4Kman/suricata-prettifier","Command-line tool to format and syntax highlight Suricata rules","https://github.com/theY4Kman/suricata-prettifier","Python","13","2","2018-06-03T04:07:29Z","2024-06-24T11:20:17Z"
"zam89/suricatalogparser","A simple log parser for Suricata log file (JSON)","https://github.com/zam89/suricatalogparser","PHP","8","1","2016-06-14T15:57:08Z","2024-06-04T23:04:44Z"
"josevnz/SuricataLog","SuricataLog is a set of tools/ scripts to parse and display Suricata log files (like /var/log/suricata/eve.json)","https://github.com/josevnz/SuricataLog","Python","23","3","2022-04-17T15:35:41Z","2025-04-20T21:45:58Z"
"hasherezade/pe_to_shellcode","Converts PE into a shellcode","https://github.com/hasherezade/pe_to_shellcode","C++","2538","452","2018-08-19T22:57:07Z","2025-05-15T08:03:33Z"
"hasherezade/transacted_hollowing","Transacted Hollowing - a PE injection technique, hybrid between ProcessHollowing and ProcessDoppelg├ñnging","https://github.com/hasherezade/transacted_hollowing","C","547","82","2021-06-05T13:39:51Z","2025-05-13T13:20:28Z"
"jxy-s/herpaderping","Process Herpaderping proof of concept, tool, and technical deep dive. Process Herpaderping bypasses security products by obscuring the intentions of a process.","https://github.com/jxy-s/herpaderping","C++","1136","220","2020-07-08T19:26:16Z","2025-05-17T14:47:38Z"
"Hagrid29/herpaderply_hollowing","Herpaderply Hollowing - a PE injection technique, hybrid between Process Hollowing and Process Herpaderping","https://github.com/Hagrid29/herpaderply_hollowing","C","56","14","2022-10-07T19:12:31Z","2025-05-05T09:15:41Z"
"mattifestation/WDACTools","A PowerShell module to facilitate building, configuring, deploying, and auditing Windows Defender Application Control (WDAC) policies","https://github.com/mattifestation/WDACTools","PowerShell","215","37","2020-02-08T15:07:53Z","2025-04-29T06:10:29Z"
"thomaspatzke/elk-detection-lab","An ELK environment containing interesting security datasets.","https://github.com/thomaspatzke/elk-detection-lab","Shell","137","23","2020-01-03T23:15:34Z","2025-05-07T20:25:44Z"
"commial/experiments","Expriments","https://github.com/commial/experiments","Python","456","80","2020-02-14T14:31:59Z","2025-05-16T18:27:38Z"
"marcosValle/awesome-windows-red-team"," A curated list of awesome Windows frameworks, libraries, software and resources for Red Teams","https://github.com/marcosValle/awesome-windows-red-team",,"578","105","2018-09-23T14:21:34Z","2025-05-16T01:51:50Z"
"CyberSecurityUP/Windows-API-for-Red-Team",,"https://github.com/CyberSecurityUP/Windows-API-for-Red-Team","Python","70","24","2023-09-24T23:18:18Z","2025-05-04T04:55:58Z"
"theintercept/sidtoday","Snowden Archive: The SIDtoday Files","https://github.com/theintercept/sidtoday",,"405","50","2016-05-12T19:43:20Z","2025-04-18T09:46:50Z"
"iamcryptoki/snowden-archive","­ƒÆÑ A collection of all documents leaked by former NSA contractor and whistleblower Edward Snowden.","https://github.com/iamcryptoki/snowden-archive",,"1167","169","2017-01-21T22:15:48Z","2025-05-17T16:25:12Z"
"center-for-threat-informed-defense/attack-workbench-frontend","An application allowing users to explore, create, annotate, and share extensions of the MITRE ATT&CK┬« knowledge base. This repository contains an Angular-based web application providing the user interface for the ATT&CK Workbench application.","https://github.com/center-for-threat-informed-defense/attack-workbench-frontend","TypeScript","356","63","2020-02-21T13:38:29Z","2025-05-17T15:06:36Z"
"mitre-attack/attack-navigator","Web app that provides basic navigation and annotation of ATT&CK matrices","https://github.com/mitre-attack/attack-navigator","TypeScript","2138","625","2018-02-26T18:29:21Z","2025-05-18T01:56:10Z"
"FalconForceTeam/FalconHound","FalconHound is a blue team multi-tool. It allows you to utilize and enhance the power of BloodHound in a more automated fashion. It is designed to be used in conjunction with a SIEM or other log aggregation tool. ","https://github.com/FalconForceTeam/FalconHound","Go","798","54","2023-10-16T18:28:08Z","2025-05-17T13:34:41Z"
"FalconForceTeam/KQLAnalyzer","REST server that can analyze Kusto KQL queries against the Sentinel and Microsoft 365 Defender schemas.","https://github.com/FalconForceTeam/KQLAnalyzer","C#","33","13","2023-03-07T10:07:21Z","2025-05-12T20:34:01Z"
"FalconForceTeam/FalconFriday","Hunting queries and detections","https://github.com/FalconForceTeam/FalconFriday",,"800","97","2020-08-04T10:25:37Z","2025-05-15T07:04:54Z"
"decalage2/ViperMonkey","A VBA parser and emulation engine to analyze malicious macros.","https://github.com/decalage2/ViperMonkey","Python","1092","186","2016-09-25T19:27:22Z","2025-05-13T17:23:54Z"
"BankSecurity/Threat_Hunting","Some Threat Hunting queries useful for blue teamers","https://github.com/BankSecurity/Threat_Hunting",,"126","24","2022-05-07T13:23:47Z","2025-05-10T21:44:49Z"
"jthuraisamy/TelemetrySourcerer","Enumerate and disable common sources of telemetry used by AV/EDR.","https://github.com/jthuraisamy/TelemetrySourcerer","C++","796","128","2020-07-30T00:01:03Z","2025-05-16T18:41:33Z"
"WiredPulse/PoSh-R2_GUI","GUI version of PoSh-R2","https://github.com/WiredPulse/PoSh-R2_GUI","PowerShell","10","3","2017-04-03T12:01:32Z","2024-09-12T10:47:22Z"
"microsoft/ReverseDSC","Utility Library that Handles the Extraction of a DSC configuration script from an existing environment","https://github.com/microsoft/ReverseDSC","PowerShell","146","47","2017-08-23T14:52:21Z","2025-05-07T11:47:13Z"
"mvelazc0/BadZure","BadZure orchestrates the setup of Azure AD tenants, populating them with diverse entities while also introducing common security misconfigurations to create vulnerable tenants with multiple attack paths.","https://github.com/mvelazc0/BadZure","Python","457","28","2023-05-05T04:52:21Z","2025-05-13T23:45:42Z"
"eshlomo1/Microsoft-Sentinel-SecOps","Microsoft Sentinel SOC Operations","https://github.com/eshlomo1/Microsoft-Sentinel-SecOps","PowerShell","254","66","2020-02-27T10:42:46Z","2025-05-14T01:52:57Z"
"RoqueNight/DefenderATP-Proactive-Threat-Hunting-Queries-KQL","List of custom developed KQL queries to help proactive security teams hunt for opportunistic and sophisticated threat activity by developing custom TTP'S from red-teaming engagements & simulations with the strategic goal to prevent threats before they have the opportunity to execute ","https://github.com/RoqueNight/DefenderATP-Proactive-Threat-Hunting-Queries-KQL",,"26","4","2021-05-22T18:30:08Z","2025-04-04T03:34:37Z"
"XForceIR/SideLoadHunter",,"https://github.com/XForceIR/SideLoadHunter",,"25","5","2022-02-11T15:23:28Z","2025-02-03T02:33:54Z"
"forensicanalysis/artifactcollector","­ƒº¡ The artifactcollector is a customizable agent to collect forensic artifacts on any Windows, macOS or Linux system","https://github.com/forensicanalysis/artifactcollector","Go","287","23","2020-01-03T15:16:28Z","2025-05-14T13:34:16Z"
"mitre/emb3d",,"https://github.com/mitre/emb3d","HTML","28","9","2024-03-20T19:58:40Z","2025-05-08T14:54:29Z"
"LearningKijo/KQL","Threat Hunting query in Microsoft 365 Defender, XDR. Provide out-of-the-box KQL hunting queries - App, Email, Identity and Endpoint.","https://github.com/LearningKijo/KQL",,"468","83","2022-12-12T05:23:03Z","2025-05-16T15:35:02Z"
"waf/CSharpRepl","A command line C# REPL with syntax highlighting ÔÇô explore the language, libraries and nuget packages interactively.","https://github.com/waf/CSharpRepl","C#","3100","115","2021-04-03T12:52:25Z","2025-05-18T01:18:53Z"
"microsoft/Windows-driver-samples","This repo contains driver samples prepared for use with Microsoft Visual Studio and the Windows Driver Kit (WDK). It contains both Universal Windows Driver and desktop-only driver samples.","https://github.com/microsoft/Windows-driver-samples","C","7303","4982","2015-03-06T22:16:09Z","2025-05-17T16:14:31Z"
"microsoft/Windows-classic-samples","This repo contains samples that demonstrate the API used in Windows classic desktop applications.","https://github.com/microsoft/Windows-classic-samples",,"5316","3280","2015-09-08T15:45:22Z","2025-05-17T16:15:00Z"
"cisagov/parsnip",,"https://github.com/cisagov/parsnip","Python","71","13","2024-01-03T19:42:44Z","2025-04-04T03:54:45Z"
"Bert-JanP/Hunting-Queries-Detection-Rules","KQL Queries. Defender For Endpoint and Azure Sentinel Hunting and Detection Queries in KQL. Out of the box KQL queries for: Advanced Hunting, Custom Detection, Analytics Rules & Hunting Rules. ","https://github.com/Bert-JanP/Hunting-Queries-Detection-Rules","Python","1456","268","2022-05-30T17:28:10Z","2025-05-18T01:58:39Z"
"mdecrevoisier/SIGMA-detection-rules","Set of SIGMA rules (>350) mapped to MITRE ATT&CK tactic and techniques","https://github.com/mdecrevoisier/SIGMA-detection-rules",,"358","74","2020-11-27T22:04:04Z","2025-05-14T15:39:52Z"
"JesseEsquivel/MDATP","Microsoft Defender Advanced Threat Protection","https://github.com/JesseEsquivel/MDATP","PowerShell","44","17","2019-09-18T17:25:14Z","2025-05-15T16:37:55Z"
"austin-lai/Collection-of-Azure-Monitor-or-Sentinel-Kusto-Queries","Collection of Azure Monitor or Sentinel Kusto Queries","https://github.com/austin-lai/Collection-of-Azure-Monitor-or-Sentinel-Kusto-Queries",,"10","4","2022-03-13T11:58:17Z","2025-02-09T02:55:47Z"
"magicsword-io/LOLBASline","Baseline a Windows System against LOLBAS","https://github.com/magicsword-io/LOLBASline","PowerShell","27","4","2024-03-10T15:36:04Z","2025-05-13T12:37:25Z"
"montysecurity/linper","Linux Persistence Toolkit","https://github.com/montysecurity/linper","Shell","59","12","2019-10-31T02:00:46Z","2025-05-14T14:56:34Z"
"mrwadams/attackgen","AttackGen is a cybersecurity incident response testing tool that leverages the power of large language models and the comprehensive MITRE ATT&CK framework. The tool generates tailored incident response scenarios based on user-selected threat actor groups and your organisation's details.","https://github.com/mrwadams/attackgen","Python","1153","151","2023-08-08T10:38:13Z","2025-05-18T02:00:05Z"
"DonnchaC/shadowbrokers-exploits","Mirror of Shadowbrokers release from https://steemit.com/shadowbrokers/@theshadowbrokers/lost-in-translation","https://github.com/DonnchaC/shadowbrokers-exploits","Python","436","187","2017-04-14T09:46:05Z","2025-05-13T14:00:31Z"
"cyb3rmik3/KQL-threat-hunting-queries","A repository of KQL queries focused on threat hunting and threat detecting for Microsoft Sentinel & Microsoft XDR (Former Microsoft 365 Defender).","https://github.com/cyb3rmik3/KQL-threat-hunting-queries",,"686","77","2022-07-19T11:15:46Z","2025-05-17T17:28:31Z"
"carlospolop/autoVolatility","Run several volatility plugins at the same time","https://github.com/carlospolop/autoVolatility","Python","114","27","2018-04-28T18:21:08Z","2025-04-01T17:04:43Z"
"alex-dengx/WSUSpendu","Implement WSUSpendu attack","https://github.com/alex-dengx/WSUSpendu","PowerShell","7","48","2017-06-08T03:07:08Z","2025-03-03T17:04:38Z"
"strontic/xcyclopedia","Encyclopedia for Executables","https://github.com/strontic/xcyclopedia","PowerShell","440","48","2020-05-27T22:13:11Z","2025-05-02T14:32:53Z"
"amlweems/xzbot","notes, honeypot, and exploit demo for the xz backdoor (CVE-2024-3094)","https://github.com/amlweems/xzbot","Go","3513","238","2024-04-01T14:28:09Z","2025-05-18T01:27:23Z"
"wagga40/Zircolite","A standalone SIGMA-based detection tool for EVTX, Auditd and Sysmon for Linux logs","https://github.com/wagga40/Zircolite","Python","712","98","2021-03-02T23:17:06Z","2025-05-09T11:29:58Z"
"fleetdm/fleet","Open-source platform for IT, security, and infrastructure teams. (Linux, macOS, Chrome, Windows, cloud, data center)","https://github.com/fleetdm/fleet","Go","4993","567","2020-11-03T22:17:18Z","2025-05-17T20:07:09Z"
"Psmths/windows-forensic-artifacts","Handbook of windows forensic artifacts across multiple Windows version with interpretation tips and some examples. Work in progress!","https://github.com/Psmths/windows-forensic-artifacts",,"350","40","2022-08-23T17:06:55Z","2025-05-14T20:31:58Z"
"svch0stz/velociraptor-detections",,"https://github.com/svch0stz/velociraptor-detections",,"21","2","2022-05-08T06:12:48Z","2025-03-06T20:15:37Z"
"mgreen27/DetectRaptor","A repository to share publicly available Velociraptor detection content","https://github.com/mgreen27/DetectRaptor","YARA","165","21","2022-11-17T11:13:49Z","2025-05-18T05:18:04Z"
"Velocidex/velociraptor-docs","Documentation site for Velociraptor","https://github.com/Velocidex/velociraptor-docs","HTML","45","221","2021-06-10T04:10:07Z","2025-05-13T11:43:30Z"
"wietze/HijackLibs","Project for tracking publicly disclosed DLL Hijacking opportunities.","https://github.com/wietze/HijackLibs",,"753","94","2021-02-27T18:22:13Z","2025-05-17T18:10:37Z"
"ldpreload/BlackLotus","BlackLotus UEFI Windows Bootkit","https://github.com/ldpreload/BlackLotus","C","2062","474","2023-07-12T17:14:40Z","2025-05-18T08:10:18Z"
"Cryakl/Ultimate-RAT-Collection","For educational purposes only, exhaustive samples of 450+ classic/modern trojan builders including screenshots.","https://github.com/Cryakl/Ultimate-RAT-Collection",,"2612","466","2023-09-12T00:41:11Z","2025-05-18T08:42:44Z"
"mgreen27/Invoke-LiveResponse","Invoke-LiveResponse","https://github.com/mgreen27/Invoke-LiveResponse","PowerShell","147","29","2018-01-14T09:42:40Z","2025-03-12T12:39:24Z"
"Velocidex/pyvelociraptor","PyVelociraptor contains the python bindings for the Velociraptor API.","https://github.com/Velocidex/pyvelociraptor","Python","17","8","2020-02-07T16:44:24Z","2025-04-22T15:42:28Z"
"Jrotenberger/Powershell-IR-Scripts",,"https://github.com/Jrotenberger/Powershell-IR-Scripts","PowerShell","39","12","2016-08-30T21:28:10Z","2024-08-06T23:54:12Z"
"polylogyx/DetectionRules",,"https://github.com/polylogyx/DetectionRules",,"10","6","2019-04-17T10:49:37Z","2024-04-01T00:00:28Z"
"AndrewRathbun/DFIRArtifactMuseum","The goal of this repo is to archive artifacts from all versions of various OS's and categorizing them by type. This will help with artifact validation processes as well as increase access to artifacts that may no longer be readily available anymore. ","https://github.com/AndrewRathbun/DFIRArtifactMuseum","HTML","597","47","2022-01-31T17:23:11Z","2025-04-30T08:05:55Z"
"googleprojectzero/sandbox-attacksurface-analysis-tools","Set of tools to analyze Windows sandboxes for exposed attack surface.","https://github.com/googleprojectzero/sandbox-attacksurface-analysis-tools","C#","2157","444","2015-10-23T03:04:22Z","2025-05-17T16:15:05Z"
"idaholab/Malcolm","Malcolm is a powerful, easily deployable network traffic analysis tool suite for full packet capture artifacts (PCAP files), Zeek logs and Suricata alerts.","https://github.com/idaholab/Malcolm","Python","405","60","2020-09-09T16:55:40Z","2025-05-15T18:22:50Z"
"cisagov/Malcolm","Malcolm is a powerful, easily deployable network traffic analysis tool suite for full packet capture artifacts (PCAP files), Zeek logs and Suricata alerts.","https://github.com/cisagov/Malcolm","Python","2121","360","2019-05-13T18:35:51Z","2025-05-18T09:51:42Z"
"vinaypamnani/wmie2",,"https://github.com/vinaypamnani/wmie2","C#","792","128","2017-10-05T22:25:10Z","2025-05-09T13:44:02Z"
"nsacyber/Windows-Event-Log-Messages","Retrieves the definitions of Windows Event Log messages embedded in Windows binaries and provides them in discoverable formats. #nsacyber","https://github.com/nsacyber/Windows-Event-Log-Messages","C#","402","98","2016-07-19T16:30:57Z","2025-04-12T03:14:22Z"
"Velocidex/Linpmem","Linpmem is a linux memory acquisition tool","https://github.com/Velocidex/Linpmem","C","83","9","2023-08-30T15:37:15Z","2025-05-13T17:13:09Z"
"Velocidex/evtx","Golang Parser for Microsoft Event Logs","https://github.com/Velocidex/evtx","Go","102","18","2019-02-09T16:14:58Z","2025-04-16T21:10:54Z"
"Velocidex/evtx-data","Publicly shareable windows event log message data","https://github.com/Velocidex/evtx-data",,"27","4","2019-11-25T07:13:41Z","2024-08-16T09:02:45Z"
"jklepsercyber/defender-detectionhistory-parser","A parser of Windows Defender's DetectionHistory forensic artifact, containing substantial info about quarantined files and executables.","https://github.com/jklepsercyber/defender-detectionhistory-parser","Python","113","15","2021-12-23T19:59:05Z","2025-02-21T10:33:03Z"
"eduardomcm/VelociraptorCompetition",,"https://github.com/eduardomcm/VelociraptorCompetition",,"11","1","2021-08-26T21:41:42Z","2024-05-27T09:57:30Z"
"splunk/PEAK","Security Content for the PEAK Threat Hunting Framework","https://github.com/splunk/PEAK","Jupyter Notebook","28","6","2023-08-10T15:17:24Z","2025-03-21T19:51:59Z"
"rod-trent/MustLearnKQL","Code included as part of the MustLearnKQL blog series","https://github.com/rod-trent/MustLearnKQL",,"1048","178","2021-11-19T16:56:41Z","2025-05-14T01:39:36Z"
"jstrosch/learning-reverse-engineering","This repository contains sample programs written primarily in C and C++ for learning native code reverse engineering.","https://github.com/jstrosch/learning-reverse-engineering","C","562","88","2019-10-01T15:28:48Z","2025-05-16T23:26:23Z"
"jstrosch/learning-malware-analysis","This repository contains sample programs that mimick behavior found in real-world malware. The goal is to provide source code that can be compiled and used for learning purposes, without having to worry about handling live malware.","https://github.com/jstrosch/learning-malware-analysis","C","638","76","2019-09-25T18:52:48Z","2025-05-17T16:19:44Z"
"marcusbakker/KQL","Kusto Query Language","https://github.com/marcusbakker/KQL",,"407","98","2019-12-10T07:18:33Z","2025-05-12T19:27:02Z"
"Azure/Azure-Sentinel","Cloud-native SIEM for intelligent security analytics for your entire enterprise.","https://github.com/Azure/Azure-Sentinel","Python","5052","3184","2018-08-18T02:25:15Z","2025-05-18T12:46:53Z"
"reprise99/Sentinel-Queries","Collection of KQL queries","https://github.com/reprise99/Sentinel-Queries",,"1517","358","2021-08-08T23:20:05Z","2025-05-14T08:01:07Z"
"GossiTheDog/ThreatHunting","Tools for hunting for threats.","https://github.com/GossiTheDog/ThreatHunting","YARA","582","56","2017-12-07T20:51:40Z","2025-05-01T22:49:47Z"
"nsacyber/GRASSMARLIN","Provides situational awareness of Industrial Control Systems (ICS) and Supervisory Control and Data Acquisition (SCADA) networks in support of network security assessments. #nsacyber","https://github.com/nsacyber/GRASSMARLIN","Java","972","306","2015-12-14T16:15:24Z","2025-05-07T21:37:02Z"
"palantir/alerting-detection-strategy-framework","A framework for developing alerting and detection strategies for incident response.","https://github.com/palantir/alerting-detection-strategy-framework",,"740","125","2017-12-19T01:33:31Z","2025-05-17T16:49:03Z"
"mlsecproject/combine","Tool to gather Threat Intelligence indicators from publicly available sources","https://github.com/mlsecproject/combine","Python","659","171","2014-02-21T17:33:21Z","2025-04-01T13:08:38Z"
"stuxnet999/MemLabs","Educational, CTF-styled labs for individuals interested in Memory Forensics","https://github.com/stuxnet999/MemLabs","Shell","1732","212","2019-08-22T04:18:14Z","2025-05-17T21:25:48Z"
"tobor88/PowerShell-Blue-Team","Collection of PowerShell functinos and scripts a Blue Teamer might use","https://github.com/tobor88/PowerShell-Blue-Team","PowerShell","84","20","2019-11-20T22:10:20Z","2025-05-08T23:44:20Z"
"dhoelzer/ShowMeThePackets","Useful network monitoring, analysis, and active response tools used or mentioned in the SANS SEC503 course (https://www.sans.org/course/intrusion-detection-in-depth)","https://github.com/dhoelzer/ShowMeThePackets","Jupyter Notebook","227","43","2018-08-22T14:08:28Z","2025-05-03T07:38:14Z"
"matthewdunwoody/block-parser","Parser for Windows PowerShell script block logs","https://github.com/matthewdunwoody/block-parser","Python","95","16","2016-02-23T00:01:50Z","2025-02-03T11:19:11Z"
"fullmetalcache/tools","Various tools, scripts, and techniques","https://github.com/fullmetalcache/tools","PowerShell","19","6","2015-12-15T04:30:11Z","2024-10-11T08:12:42Z"
"WithSecureLabs/chainsaw","Rapidly Search and Hunt through Windows Forensic Artefacts","https://github.com/WithSecureLabs/chainsaw","Rust","3146","275","2021-08-13T13:07:24Z","2025-05-17T16:23:02Z"
"rastrea2r/rastrea2r","Collecting & Hunting for IOCs with gusto and style","https://github.com/rastrea2r/rastrea2r","Python","238","53","2018-05-01T18:21:52Z","2025-04-10T06:00:59Z"
"Infocyte/PSHunt","Powershell Threat Hunting Module","https://github.com/Infocyte/PSHunt","PowerShell","283","65","2016-08-11T02:58:14Z","2025-02-22T21:48:54Z"
"ahmedkhlief/APT-Hunter","APT-Hunter is Threat Hunting tool for windows event logs which made by purple team mindset to provide detect APT movements hidden in the sea of windows event logs to decrease the time to uncover suspicious activity","https://github.com/ahmedkhlief/APT-Hunter","Python","1336","242","2020-12-26T21:52:41Z","2025-05-15T11:05:48Z"
"ethack/tht","Threat Hunting Toolkit is a Swiss Army knife for threat hunting, log processing, and security-focused data science","https://github.com/ethack/tht","Shell","137","18","2021-03-17T04:27:55Z","2025-05-01T01:07:26Z"
"OTRF/infosec-jupyter-book","The Infosec Community Definitive Guide to Jupyter Notebooks","https://github.com/OTRF/infosec-jupyter-book","Dockerfile","121","30","2020-03-10T05:01:46Z","2025-01-22T07:49:34Z"
"Yamato-Security/hayabusa","Hayabusa (ÚÜ╝) is a sigma-based threat hunting and fast forensics timeline generator for Windows event logs.","https://github.com/Yamato-Security/hayabusa","Rust","2607","220","2020-09-18T05:04:33Z","2025-05-17T09:45:08Z"
"mgeeky/cobalt-arsenal","My collection of battle-tested Aggressor Scripts for Cobalt Strike 4.0+","https://github.com/mgeeky/cobalt-arsenal","PowerShell","1080","155","2020-04-09T13:39:47Z","2025-05-15T19:18:59Z"
"hasherezade/pe-sieve","Scans a given process. Recognizes and dumps a variety of potentially malicious implants (replaced/injected PEs, shellcodes, hooks, in-memory patches).","https://github.com/hasherezade/pe-sieve","C++","3310","450","2017-08-22T01:33:00Z","2025-05-18T09:54:21Z"
"daveherrald/SA_plaso-app-for-splunk",,"https://github.com/daveherrald/SA_plaso-app-for-splunk","JavaScript","15","3","2016-06-08T01:05:31Z","2024-02-21T07:42:47Z"
"LDO-CERT/orochi","The Volatility Collaborative GUI","https://github.com/LDO-CERT/orochi","JavaScript","242","21","2020-05-18T14:01:45Z","2025-04-27T17:06:53Z"
"dwmetz/CyberPipe","An easy to use PowerShell script to collect memory and disk forensics for DFIR investigations.","https://github.com/dwmetz/CyberPipe","PowerShell","287","50","2021-01-13T19:34:50Z","2025-05-12T03:36:42Z"
"MagnetForensics/Magnet-RESPONSE-PowerShell","PowerShell scripts for running Magnet RESPONSE forensic collection tool in large enterprises.","https://github.com/MagnetForensics/Magnet-RESPONSE-PowerShell","PowerShell","24","6","2023-09-15T20:16:17Z","2025-02-13T14:30:29Z"
