"full_name","description","html_url","language","stargazers_count","forks_count","created_at","updated_at"
"vxunderground/MalwareSourceCode","Collection of malware source code for a variety of platforms in an array of different programming languages.","https://github.com/vxunderground/MalwareSourceCode","Assembly","16780","1904","2020-10-10T02:48:57Z","2025-05-18T12:27:08Z"
"hasherezade/malware_training_vol1","Materials for Windows Malware Analysis training (volume 1)","https://github.com/hasherezade/malware_training_vol1","Assembly","1988","197","2021-03-22T14:06:13Z","2025-05-12T14:04:35Z"
"ForbiddenProgrammer/conti-pentester-guide-leak","Leaked pentesting manuals given to Conti ransomware crooks","https://github.com/ForbiddenProgrammer/conti-pentester-guide-leak","Batchfile","1028","259","2021-08-06T23:23:11Z","2025-05-18T02:01:10Z"
"rasta-mouse/Sherlock","PowerShell script to quickly find missing software patches for local privilege escalation vulnerabilities.","https://github.com/rasta-mouse/Sherlock","PowerShell","1940","425","2017-04-02T16:01:53Z","2025-05-16T21:59:41Z"
"nyxgeek/o365recon","retrieve information via O365 and AzureAD with a valid cred","https://github.com/nyxgeek/o365recon","PowerShell","720","102","2017-09-02T17:19:42Z","2025-05-10T23:23:04Z"
"phra/PEzor","Open-Source Shellcode & PE Packer","https://github.com/phra/PEzor","C","1949","328","2020-07-22T09:45:52Z","2025-05-17T16:21:07Z"
"Flangvik/SharpCollection","Nightly builds of common C# offensive tools, fresh from their respective master branches built and released in a CDI fashion using Azure DevOps release pipelines.","https://github.com/Flangvik/SharpCollection",,"2477","355","2020-06-05T12:50:00Z","2025-05-17T08:08:06Z"
"itm4n/PrintSpoofer","Abusing impersonation privileges through the ""Printer Bug""","https://github.com/itm4n/PrintSpoofer","C","1997","344","2020-04-28T08:26:29Z","2025-05-16T10:52:05Z"
"pandasec888/taowu-cobalt_strike",,"https://github.com/pandasec888/taowu-cobalt_strike",,"1798","330","2020-07-05T10:13:00Z","2025-05-17T20:46:30Z"
"b4rtik/SharpKatz","Porting of mimikatz sekurlsa::logonpasswords,  sekurlsa::ekeys and lsadump::dcsync commands","https://github.com/b4rtik/SharpKatz","C#","1001","136","2020-05-19T17:56:46Z","2025-05-08T09:48:07Z"
"timwhitez/Cobalt-Strike-Aggressor-Scripts","Cobalt Strike Aggressor µÅÆõ╗ÂÕîà","https://github.com/timwhitez/Cobalt-Strike-Aggressor-Scripts","C","670","99","2019-10-12T06:13:31Z","2025-05-17T22:30:41Z"
"GDSSecurity/PSAttack","A portable console aimed at making pentesting with PowerShell a little easier.","https://github.com/GDSSecurity/PSAttack","C#","45","15","2016-02-22T23:45:22Z","2025-01-17T00:00:55Z"
"carnal0wnage/ApplicationWhitelistBypassTechniques","A Catalog of Application Whitelisting Bypass Techniques","https://github.com/carnal0wnage/ApplicationWhitelistBypassTechniques",,"31","116","2015-01-16T21:21:49Z","2024-08-12T19:15:56Z"
"Ben0xA/nps","Not PowerShell","https://github.com/Ben0xA/nps","C#","446","87","2015-12-18T18:49:38Z","2025-04-20T11:01:21Z"
"tijme/binaries","A mirror of several precompiled standalone red-teaming tools.","https://github.com/tijme/binaries","PowerShell","19","4","2019-02-09T12:29:41Z","2025-04-28T21:01:20Z"
"S3cur3Th1sSh1t/PowerSharpPack",,"https://github.com/S3cur3Th1sSh1t/PowerSharpPack","PowerShell","1586","308","2020-04-06T16:34:52Z","2025-05-17T20:15:23Z"
"vletoux/SpoolerScanner","Check if MS-RPRN is remotely available with powershell/c#","https://github.com/vletoux/SpoolerScanner","PowerShell","173","44","2018-10-21T09:17:27Z","2025-03-29T16:50:11Z"
"hausec/ADAPE-Script","Active Directory Assessment and Privilege Escalation Script","https://github.com/hausec/ADAPE-Script","PowerShell","1103","209","2018-03-30T03:53:46Z","2025-04-29T12:19:16Z"
"funkandwagnalls/ranger","A tool for security professionals to access and interact with remote Microsoft Windows based systems.","https://github.com/funkandwagnalls/ranger","Python","431","85","2015-07-13T17:20:54Z","2025-05-04T20:58:18Z"
"maaaaz/impacket-examples-windows","The great impacket example scripts compiled for Windows","https://github.com/maaaaz/impacket-examples-windows",,"956","218","2016-01-24T16:42:02Z","2025-05-17T18:17:46Z"
"fullhunt/log4j-scan","A fully automated, accurate, and extensive scanner for finding log4j RCE CVE-2021-44228 ","https://github.com/fullhunt/log4j-scan","Python","3417","744","2021-12-13T03:57:50Z","2025-05-18T04:41:56Z"
"NotMedic/NetNTLMtoSilverTicket","SpoolSample -> Responder w/NetNTLM Downgrade -> NetNTLMv1 -> NTLM -> Kerberos Silver Ticket","https://github.com/NotMedic/NetNTLMtoSilverTicket","PowerShell","855","115","2019-01-14T15:32:27Z","2025-05-14T16:39:19Z"
"safebuffer/vulnerable-AD","Create a vulnerable active directory that's allowing you to test most of the active directory attacks in a local lab ","https://github.com/safebuffer/vulnerable-AD","PowerShell","2122","411","2020-06-19T09:30:18Z","2025-05-17T17:51:03Z"
"Yaxser/CobaltStrike-BOF","Collection of beacon BOF written to learn windows and cobaltstrike","https://github.com/Yaxser/CobaltStrike-BOF","C++","348","57","2020-10-08T01:12:41Z","2025-05-16T01:59:31Z"
"c3c/ADExplorerSnapshot.py","ADExplorerSnapshot.py is an AD Explorer snapshot parser. It is made as an ingestor for BloodHound, and also supports full-object dumping to NDJSON.","https://github.com/c3c/ADExplorerSnapshot.py","Python","964","129","2021-12-22T14:42:23Z","2025-05-18T09:30:47Z"
"google/rekall","Rekall Memory Forensic Framework","https://github.com/google/rekall","Python","1949","397","2014-05-16T17:22:51Z","2025-05-15T19:18:14Z"
"FuzzySecurity/PowerShell-Suite","My musings with PowerShell","https://github.com/FuzzySecurity/PowerShell-Suite","PowerShell","2664","769","2015-12-11T13:14:41Z","2025-05-14T16:44:43Z"
"FuzzySecurity/Sharp-Suite","Also known by Microsoft as Knifecoat :hot_pepper:","https://github.com/FuzzySecurity/Sharp-Suite","C#","1134","204","2018-12-10T00:08:37Z","2025-05-11T09:28:57Z"
"NetSPI/MicroBurst","A collection of scripts for assessing Microsoft Azure security","https://github.com/NetSPI/MicroBurst","PowerShell","2159","318","2018-07-16T16:47:20Z","2025-05-14T13:49:01Z"
"poweradminllc/PAExec","Remote execution, like PsExec","https://github.com/poweradminllc/PAExec","C++","560","178","2013-11-13T04:05:27Z","2025-05-15T15:02:42Z"
"hak5/usbrubberducky-payloads","The Official USB Rubber Ducky Payload Repository","https://github.com/hak5/usbrubberducky-payloads","PowerShell","4771","1483","2021-07-13T22:03:56Z","2025-05-17T19:43:55Z"
"tobor88/ReversePowerShell","Functions that can be used to gain Reverse Shells with PowerShell","https://github.com/tobor88/ReversePowerShell","PowerShell","83","15","2019-11-20T17:47:19Z","2025-02-16T22:49:58Z"
"Integration-IT/Active-Directory-Exploitation-Cheat-Sheet","A cheat sheet that contains common enumeration and attack methods for Windows Active Directory.","https://github.com/Integration-IT/Active-Directory-Exploitation-Cheat-Sheet","PowerShell","2582","515","2020-05-28T21:19:37Z","2025-05-17T23:17:16Z"
"kurogai/100-redteam-projects","Projects for security students","https://github.com/kurogai/100-redteam-projects","Python","2526","386","2020-05-20T20:57:38Z","2025-05-18T03:39:38Z"
"screetsec/Brutal","Payload for teensy like a rubber ducky but the syntax is different. this Human interfaes device ( HID attacks ). Penetration With Teensy  . Brutal is a toolkit to quickly create various payload,powershell attack , virus attack and launch listener for a Human Interface Device ( Payload Teensy )","https://github.com/screetsec/Brutal","C++","1161","274","2016-11-01T03:30:05Z","2025-05-10T07:31:20Z"
"milo2012/portia","Portia aims to automate a number of techniques commonly performed on internal network penetration tests after a low privileged account has been compromised.  Portia performs privilege escalation as well as lateral movement automatically in the network","https://github.com/milo2012/portia","PowerShell","170","60","2017-05-24T00:23:47Z","2025-05-08T12:01:14Z"
"lengjibo/RedTeamTools","Þ«░Õ¢òÞç¬ÕÀ▒þ╝ûÕåÖÒÇüõ┐«µö╣þÜäÚâ¿ÕêåÕÀÑÕàÀ","https://github.com/lengjibo/RedTeamTools","Python","1448","353","2020-01-28T05:49:16Z","2025-05-18T01:48:30Z"
"enigma0x3/Powershell-C2",,"https://github.com/enigma0x3/Powershell-C2","PowerShell","52","21","2014-01-17T05:46:31Z","2025-02-24T20:58:21Z"
"enigma0x3/Powershell-Payload-Excel-Delivery","Uses Invoke-Shellcode to execute a payload and persist on the system.","https://github.com/enigma0x3/Powershell-Payload-Excel-Delivery","PowerShell","114","44","2014-01-07T20:34:47Z","2025-05-12T10:20:51Z"
"Cn33liz/p0wnedShell","PowerShell Runspace Post Exploitation Toolkit","https://github.com/Cn33liz/p0wnedShell","C#","1537","334","2015-12-25T11:44:37Z","2025-05-16T10:51:00Z"
"vlad902/hacking-team-windows-kernel-lpe","Previously-0day exploit from the Hacking Team leak, written by Eugene Ching/Qavar.","https://github.com/vlad902/hacking-team-windows-kernel-lpe","C","199","88","2015-07-11T22:48:59Z","2025-05-15T10:44:18Z"
"BorjaMerino/Pazuzu","Pazuzu: Reflective DLL to run binaries from memory","https://github.com/BorjaMerino/Pazuzu","Python","215","64","2015-10-05T12:23:17Z","2025-04-17T00:48:24Z"
"Kevin-Robertson/Invoke-TheHash","PowerShell Pass The Hash Utils","https://github.com/Kevin-Robertson/Invoke-TheHash","PowerShell","1578","308","2017-01-03T01:05:39Z","2025-05-15T15:16:48Z"
"Neo23x0/log4shell-detector","Detector for Log4Shell exploitation attempts","https://github.com/Neo23x0/log4shell-detector","Python","731","122","2021-12-11T11:37:05Z","2025-04-22T08:56:31Z"
"chryzsh/awesome-bloodhound","A curated list of awesome BloodhoundAD resources","https://github.com/chryzsh/awesome-bloodhound",,"230","34","2019-10-20T08:50:59Z","2025-03-28T22:57:01Z"
"chryzsh/awesome-windows-security","List of Awesome Windows Security Resources","https://github.com/chryzsh/awesome-windows-security",,"298","55","2018-11-11T10:23:44Z","2025-05-05T15:49:11Z"
"chryzsh/DarthSidious","Building an Active Directory domain and hacking it","https://github.com/chryzsh/DarthSidious",,"652","142","2017-06-21T13:30:26Z","2025-05-16T01:55:10Z"
"chryzsh/JenkinsPasswordSpray","A tool to password spray Jenkins instances","https://github.com/chryzsh/JenkinsPasswordSpray","PowerShell","56","10","2019-05-03T08:39:28Z","2025-04-17T00:36:05Z"
"JohnHammond/CVE-2021-34527",,"https://github.com/JohnHammond/CVE-2021-34527","PowerShell","280","70","2021-07-02T12:10:49Z","2025-05-14T21:07:21Z"
"certsocietegenerale/FIR","Fast Incident Response","https://github.com/certsocietegenerale/FIR","JavaScript","1874","512","2015-03-11T16:23:34Z","2025-05-18T10:24:04Z"
"The-Art-of-Hacking/h4cker","This repository is primarily maintained by Omar Santos (@santosomar) and includes thousands of resources related to ethical hacking, bug bounties, digital forensics and incident response (DFIR), artificial intelligence security, vulnerability research, exploit development, reverse engineering, and more.","https://github.com/The-Art-of-Hacking/h4cker","Jupyter Notebook","21023","3900","2017-06-19T17:11:19Z","2025-05-18T11:59:54Z"
"Vozzie/uacscript","Windows 7 UAC Bypass Vulnerability in the Windows Script Host","https://github.com/Vozzie/uacscript","Visual Basic","105","28","2015-08-22T16:26:33Z","2025-05-07T13:19:14Z"
"enigma0x3/Misc-PowerShell-Stuff","random powershell goodness","https://github.com/enigma0x3/Misc-PowerShell-Stuff","PowerShell","447","162","2015-08-25T21:51:25Z","2025-04-29T03:47:18Z"
"DidierStevens/DidierStevensSuite","Please no pull requests for this repository. Thanks!","https://github.com/DidierStevens/DidierStevensSuite","Python","2214","557","2015-05-08T11:21:00Z","2025-05-15T17:23:34Z"
"FatRodzianko/SharpBypassUAC","C# tool for UAC bypasses","https://github.com/FatRodzianko/SharpBypassUAC","C#","430","56","2019-10-26T20:54:07Z","2025-05-06T22:19:03Z"
"hfiref0x/UACME","Defeating Windows User Account Control","https://github.com/hfiref0x/UACME","C","6753","1354","2015-03-28T12:04:33Z","2025-05-17T16:14:36Z"
"hatRiot/token-priv","Token Privilege Research","https://github.com/hatRiot/token-priv","C++","821","174","2017-07-19T06:01:36Z","2025-05-15T19:10:43Z"
"breenmachine/RottenPotatoNG","New version of RottenPotato as a C++ DLL and standalone C++ binary - no need for meterpreter or other tools.","https://github.com/breenmachine/RottenPotatoNG","C++","938","184","2017-12-29T13:19:03Z","2025-05-16T12:57:38Z"
"foxglovesec/RottenPotato","RottenPotato local privilege escalation from service account to SYSTEM","https://github.com/foxglovesec/RottenPotato","C#","674","137","2016-09-23T19:02:31Z","2025-05-17T10:20:03Z"
"mozilla/fxa-password-strength-checker","Utility library for checking the strength of a user's password","https://github.com/mozilla/fxa-password-strength-checker","JavaScript","10","7","2015-07-23T22:52:30Z","2024-10-11T12:31:30Z"
"improvedk/OrcaMDF","A C# parser for MDF files. Allows you to read tables, metadata and indexes from MDF files without it being attached to a running SQL Server instance.","https://github.com/improvedk/OrcaMDF","C#","185","73","2011-04-15T17:47:08Z","2025-03-12T01:13:51Z"
"microsoft/Microsoft-365-Defender-Hunting-Queries","Sample queries for Advanced hunting in Microsoft 365 Defender","https://github.com/microsoft/Microsoft-365-Defender-Hunting-Queries","Jupyter Notebook","1990","556","2018-03-18T12:07:42Z","2025-05-18T01:56:48Z"
"trustedsec/ptf","The Penetration Testers Framework (PTF) is a way for modular support for up-to-date tools.","https://github.com/trustedsec/ptf","Python","5300","1260","2015-05-12T18:37:25Z","2025-05-18T08:18:32Z"
"splunk/security_content","Splunk Security Content","https://github.com/splunk/security_content","Python","1423","397","2018-12-18T21:14:15Z","2025-05-16T18:49:32Z"
"sduff/awesome-splunk","  A collection of awesome resources for Splunk","https://github.com/sduff/awesome-splunk",,"136","17","2019-09-08T13:07:10Z","2025-05-17T20:15:23Z"
"Truvis/SplunkDashboards","Collection of Dashboards for Threat Hunting and more!","https://github.com/Truvis/SplunkDashboards",,"68","12","2020-09-01T00:51:52Z","2025-04-30T07:49:26Z"
"tobor88/PowerShell-Red-Team","Collection of PowerShell functions a Red Teamer may use in an engagement","https://github.com/tobor88/PowerShell-Red-Team","PowerShell","522","92","2019-11-20T22:07:50Z","2025-04-28T09:36:11Z"
"ffffffff0x/f8x","þ║ó/ÞôØÚÿƒþÄ»ÕóâÞç¬Õè¿ÕîûÚâ¿þ¢▓ÕÀÑÕàÀ | Red/Blue team environment automation deployment tool","https://github.com/ffffffff0x/f8x","Shell","1930","285","2021-01-21T06:27:27Z","2025-05-18T01:47:54Z"
"S3cur3Th1sSh1t/OffensiveVBA","This repo covers some code execution and AV Evasion methods for Macros in Office documents","https://github.com/S3cur3Th1sSh1t/OffensiveVBA","VBA","1229","228","2021-10-10T16:44:14Z","2025-05-15T13:50:29Z"
"FourCoreLabs/EDRHunt","Scan installed EDRs and AVs on Windows","https://github.com/FourCoreLabs/EDRHunt","Go","583","81","2021-09-20T19:57:47Z","2025-05-12T14:05:43Z"
"b3dk7/StegExpose","A steganalysis tool for detecting LSB steganography in images","https://github.com/b3dk7/StegExpose","Java","214","58","2014-08-03T08:38:52Z","2025-04-30T17:17:10Z"
"DominicBreuker/stego-toolkit","Collection of steganography tools - helps with CTF challenges","https://github.com/DominicBreuker/stego-toolkit","Shell","2518","316","2017-10-17T13:17:00Z","2025-05-17T05:19:55Z"
"lukechampine/jsteg","JPEG steganography","https://github.com/lukechampine/jsteg","Go","627","37","2017-09-09T20:35:42Z","2025-05-18T06:40:50Z"
"USArmyResearchLab/Dshell","Dshell is a network forensic analysis framework.","https://github.com/USArmyResearchLab/Dshell","Python","5486","1144","2014-12-17T12:04:51Z","2025-05-18T12:17:35Z"
"tomchop/malcom","Malcom - Malware Communications Analyzer","https://github.com/tomchop/malcom","Python","1161","216","2013-06-04T15:06:25Z","2025-05-04T15:47:33Z"
"cudeso/security-tools","Security tools, scanners, exploit code","https://github.com/cudeso/security-tools","PHP","31","15","2014-11-17T13:49:45Z","2024-08-03T12:54:37Z"
"jermeyyy/rooty","Academic project of Linux rootkit made for Bachelor Engineering Thesis.","https://github.com/jermeyyy/rooty","C","103","17","2017-07-23T21:58:21Z","2025-05-08T05:04:13Z"
"OWASP/OWASP-WebScarab","OWASP WebScarab","https://github.com/OWASP/OWASP-WebScarab","Java","611","224","2009-11-20T06:57:20Z","2025-04-30T09:34:03Z"
"Veil-Framework/Veil","Veil 3.1.X (Check version info in Veil at runtime)","https://github.com/Veil-Framework/Veil","Python","4100","893","2017-03-02T08:04:43Z","2025-05-16T12:26:00Z"
"nabla-c0d3/sslyze","Fast and powerful SSL/TLS scanning library.","https://github.com/nabla-c0d3/sslyze","Python","3605","473","2014-08-18T04:33:30Z","2025-05-18T04:51:19Z"
"proxycannon/proxycannon-ng","A private botnet using multiple cloud environments for pentesters and red teamers. - Built by the community during a hackathon at the WWHF 2018 security conference","https://github.com/proxycannon/proxycannon-ng","Shell","625","105","2018-10-19T20:48:28Z","2025-05-14T12:47:21Z"
"SofianeHamlaoui/Lockdoor-Framework","­ƒöÉ Lockdoor Framework : A Penetration Testing framework with Cyber Security Resources","https://github.com/SofianeHamlaoui/Lockdoor-Framework","Python","1454","297","2019-09-06T11:59:14Z","2025-05-18T01:58:41Z"
"joswr1ght/cowpatty","coWPAtty: WPA2-PSK Cracking","https://github.com/joswr1ght/cowpatty","C","209","51","2017-08-14T20:33:22Z","2025-05-16T16:57:00Z"
"lanmaster53/recon-ng","Open Source Intelligence gathering tool aimed at reducing the time spent harvesting information from open sources.","https://github.com/lanmaster53/recon-ng","Python","4654","725","2019-03-28T17:43:52Z","2025-05-18T10:01:31Z"
"bitsadmin/fakelogonscreen","Fake Windows logon screen to steal passwords","https://github.com/bitsadmin/fakelogonscreen","C#","1346","238","2020-02-01T18:51:35Z","2025-05-18T12:35:00Z"
"Killeroo/PowerPing","Advanced command-line ping tool","https://github.com/Killeroo/PowerPing","C#","201","29","2016-11-08T19:35:59Z","2025-05-08T04:46:34Z"
"bdamele/icmpsh","Simple reverse ICMP shell","https://github.com/bdamele/icmpsh","C","1588","417","2011-04-15T10:04:12Z","2025-05-15T10:49:39Z"
"DhavalKapil/icmptunnel","Transparently tunnel your IP traffic through ICMP echo and reply packets.","https://github.com/DhavalKapil/icmptunnel","C","3133","350","2015-08-24T21:46:23Z","2025-05-14T08:11:41Z"
"utoni/ptunnel-ng","Tunnel TCP connections through ICMP.","https://github.com/utoni/ptunnel-ng","C","463","77","2017-12-19T18:10:35Z","2025-05-12T14:05:09Z"
"3gstudent/Eventlogedit-evtx--Evolution","Remove individual lines from Windows XML Event Log (EVTX) files","https://github.com/3gstudent/Eventlogedit-evtx--Evolution","C++","267","62","2018-06-05T01:21:20Z","2025-03-26T22:33:45Z"
"HASecuritySolutions/Logstash","Contains Logstash related content including tons of Logstash configurations","https://github.com/HASecuritySolutions/Logstash","Python","253","55","2017-08-16T19:26:28Z","2024-10-10T17:28:47Z"
"lgandx/Responder","Responder is a LLMNR, NBT-NS and MDNS poisoner, with built-in HTTP/SMB/MSSQL/FTP/LDAP rogue authentication server supporting NTLMv1/NTLMv2/LMv2, Extended Security NTLMSSP and Basic HTTP authentication. ","https://github.com/lgandx/Responder","Python","5811","800","2016-09-06T18:21:54Z","2025-05-17T19:06:07Z"
"LeonardoNve/sslstrip2","SSLStrip version to defeat HSTS","https://github.com/LeonardoNve/sslstrip2",,"319","133","2014-03-11T11:13:59Z","2025-05-07T15:49:59Z"
"moxie0/sslstrip","A tool for exploiting Moxie Marlinspike's SSL ""stripping"" attack.","https://github.com/moxie0/sslstrip","Python","1975","442","2011-04-24T06:40:08Z","2025-05-17T16:23:50Z"
"atredispartners/flamingo","Flamingo captures credentials sprayed across the network by various IT and security products.","https://github.com/atredispartners/flamingo","Go","454","46","2020-01-19T16:01:24Z","2025-04-30T02:23:14Z"
"yunchih/static-binaries","A set of commonly-used static binaries","https://github.com/yunchih/static-binaries",,"184","35","2017-09-07T04:00:59Z","2025-04-30T01:14:40Z"
"microsoft/etl2pcapng","Utility that converts an .etl file containing a Windows network packet capture into .pcapng format.","https://github.com/microsoft/etl2pcapng","C","679","117","2019-09-16T23:48:38Z","2025-05-08T21:49:44Z"
"3gstudent/Javascript-Backdoor","Learn from  Casey Smith @subTee","https://github.com/3gstudent/Javascript-Backdoor","PowerShell","242","109","2016-01-04T01:48:14Z","2025-05-15T18:56:04Z"
"3gstudent/Worse-PDF","Turn a normal PDF file into malicious.Use to steal Net-NTLM Hashes from windows machines.","https://github.com/3gstudent/Worse-PDF","Python","342","79","2018-05-03T08:02:37Z","2025-04-23T19:03:23Z"
"3gstudent/Pentest-and-Development-Tips","A collection of pentest and development tips","https://github.com/3gstudent/Pentest-and-Development-Tips",,"1111","304","2017-09-07T01:07:53Z","2025-05-12T05:15:14Z"
"Genetic-Malware/Ebowla","Framework for Making Environmental Keyed Payloads (NO LONGER SUPPORTED)","https://github.com/Genetic-Malware/Ebowla","Python","748","170","2016-04-07T22:29:58Z","2025-04-17T00:43:06Z"
"matterpreter/DefenderCheck","Identifies the bytes that Microsoft Defender flags on.","https://github.com/matterpreter/DefenderCheck","C#","2443","436","2019-04-09T14:03:46Z","2025-05-14T13:54:04Z"
"wapiti-scanner/wapiti","Web vulnerability scanner written in Python3","https://github.com/wapiti-scanner/wapiti","Python","1399","216","2020-06-06T20:17:55Z","2025-05-18T09:20:51Z"
"MarkBaggett/srum-dump","A forensics tool to convert the data in the Windows srum (System Resource Usage Monitor) database to an xlsx spreadsheet.","https://github.com/MarkBaggett/srum-dump","Python","666","112","2016-08-16T15:44:53Z","2025-05-14T13:28:49Z"
"carmaa/inception","Inception is a physical memory manipulation and hacking tool exploiting PCI-based DMA. The tool can attack over FireWire, Thunderbolt, ExpressCard, PC Card and any other PCI/PCIe interfaces.","https://github.com/carmaa/inception","Python","1587","198","2011-06-18T18:48:46Z","2025-05-17T16:12:44Z"
"clr2of8/DPAT","Domain Password Audit Tool for Pentesters","https://github.com/clr2of8/DPAT","Python","956","157","2016-11-22T22:00:21Z","2025-05-12T12:44:05Z"
"hashcat/hashcat","World's fastest and most advanced password recovery utility","https://github.com/hashcat/hashcat","C","22658","3071","2015-12-04T14:46:51Z","2025-05-18T12:35:23Z"
"vanhauser-thc/thc-hydra","hydra","https://github.com/vanhauser-thc/thc-hydra","C","10414","2154","2014-04-24T14:45:37Z","2025-05-18T12:43:31Z"
"robertdavidgraham/masscan","TCP port scanner, spews SYN packets asynchronously, scanning entire Internet in under 5 minutes.","https://github.com/robertdavidgraham/masscan","C","24479","3120","2013-07-28T05:35:33Z","2025-05-18T10:40:08Z"
"insecurityofthings/jackit","JackIt - Exploit Code for Mousejack","https://github.com/insecurityofthings/jackit","Python","845","150","2016-07-01T23:21:56Z","2025-05-04T00:53:57Z"
"OpenSecurityResearch/hostapd-wpe","Modified hostapd to facilitate AP impersonation attacks","https://github.com/OpenSecurityResearch/hostapd-wpe","Makefile","507","97","2012-08-21T03:15:44Z","2025-05-08T22:39:03Z"
"Hackstar7/WanaCry","WannaCry Ransomware","https://github.com/Hackstar7/WanaCry",,"137","58","2017-05-13T08:26:55Z","2025-05-07T18:23:15Z"
"Seabreg/Regshot","Regshot is a small, free and open-source registry compare utility that allows you to quickly take a snapshot of your registry and then compare it with a second one - done after doing system changes or installing a new software product","https://github.com/Seabreg/Regshot",,"362","33","2019-06-15T23:54:56Z","2025-05-17T19:00:39Z"
"Velocidex/WinPmem","The multi-platform memory acquisition tool.","https://github.com/Velocidex/WinPmem","C","790","112","2019-05-17T05:10:59Z","2025-05-16T00:21:04Z"
"thimbleweed/All-In-USB",,"https://github.com/thimbleweed/All-In-USB","PHP","145","56","2012-01-12T09:53:51Z","2025-04-01T13:58:21Z"
"gchq/CyberChef","The Cyber Swiss Army Knife - a web app for encryption, encoding, compression and data analysis","https://github.com/gchq/CyberChef","JavaScript","31241","3504","2016-11-28T10:34:07Z","2025-05-18T11:24:49Z"
"S3cur3Th1sSh1t/Excel-Phish","Phish password protected Excel-Files","https://github.com/S3cur3Th1sSh1t/Excel-Phish","VBA","104","19","2020-12-14T20:05:38Z","2025-04-10T21:39:13Z"
"CVEProject/cvelist","Pilot program for CVE submission through GitHub. CVE Record Submission via Pilot PRs ending 6/30/2023","https://github.com/CVEProject/cvelist",,"1466","767","2020-11-02T19:30:55Z","2025-05-18T12:00:48Z"
"phantomcyber/playbooks","Phantom Community Playbooks","https://github.com/phantomcyber/playbooks","Python","500","205","2015-08-31T22:35:12Z","2025-05-05T08:26:09Z"
"payloadbox/xss-payload-list","­ƒÄ» Cross Site Scripting ( XSS ) Vulnerability Payload List","https://github.com/payloadbox/xss-payload-list",,"7079","1787","2018-04-23T06:09:29Z","2025-05-18T08:36:42Z"
"keydet89/RegRipper3.0","RegRipper3.0","https://github.com/keydet89/RegRipper3.0","Perl","604","131","2020-05-27T15:24:38Z","2025-05-15T11:04:51Z"
"rapid7/warvox",,"https://github.com/rapid7/warvox","Ruby","206","56","2011-11-08T21:34:07Z","2024-12-02T08:44:18Z"
"rasta-mouse/Rosplant",,"https://github.com/rasta-mouse/Rosplant","C#","52","2","2021-09-16T12:28:25Z","2025-04-17T00:30:13Z"
"praetorian-inc/purple-team-attack-automation","Praetorian's public release of our Metasploit automation of MITRE ATT&CKÔäó TTPs","https://github.com/praetorian-inc/purple-team-attack-automation","Ruby","722","119","2019-04-08T19:56:41Z","2025-04-08T20:29:30Z"
