"full_name","description","html_url","language","stargazers_count","forks_count","created_at","updated_at"
"fugawi/mate","Mitre Att&ck Technique Emulation","https://github.com/fugawi/mate","PowerShell","82","15","2018-10-23T14:36:41Z","2023-11-03T03:35:36Z"
"nsacyber/unfetter","Identifies defensive gaps in security posture by leveraging Mitre's ATT&CK framework. #nsacyber","https://github.com/nsacyber/unfetter",,"163","39","2016-09-12T15:53:29Z","2024-05-26T07:06:42Z"
"jymcheong/AutoTTP","Automated Tactics Techniques & Procedures","https://github.com/jymcheong/AutoTTP","Python","254","63","2017-09-07T06:25:53Z","2025-05-14T10:17:00Z"
"TryCatchHCF/DumpsterFire","""Security Incidents In A Box!""   A modular, menu-driven, cross-platform tool for building customized, time-delayed, distributed security events. Easily create custom event chains for Blue- & Red Team drills and sensor / alert mapping. Red Teams can create decoy incidents, distractions, and lures to support and scale their operations. Build event sequences (""narratives"") to simulate realistic scenarios and generate corresponding network and filesystem artifacts.","https://github.com/TryCatchHCF/DumpsterFire","Python","1013","147","2017-10-05T23:44:54Z","2025-05-18T01:49:02Z"
"guardicore/monkey","Infection Monkey - An open-source adversary emulation platform","https://github.com/guardicore/monkey","Python","6800","799","2015-08-30T07:22:51Z","2025-05-18T05:53:38Z"
"OTRF/Security-Datasets","Re-play Security Events","https://github.com/OTRF/Security-Datasets","PowerShell","1644","244","2018-05-31T19:48:47Z","2025-05-17T22:41:50Z"
"GossiTheDog/HiveNightmare","Exploit allowing you to read registry hives as non-admin on Windows 10 and 11","https://github.com/GossiTheDog/HiveNightmare","C++","758","164","2021-07-20T11:35:43Z","2025-05-16T23:28:56Z"
"google/timesketch","Collaborative forensic timeline analysis","https://github.com/google/timesketch","Python","2750","608","2014-06-19T17:49:45Z","2025-05-17T16:13:58Z"
"log2timeline/dfvfs","Digital Forensics Virtual File System (dfVFS)","https://github.com/log2timeline/dfvfs","Python","207","46","2014-09-09T05:06:44Z","2025-04-09T04:37:59Z"
"mdecrevoisier/Microsoft-eventlog-mindmap","Set of Mindmaps providing a detailed overview of the different #Microsoft auditing capacities for Windows, Exchange, Azure,...","https://github.com/mdecrevoisier/Microsoft-eventlog-mindmap",,"1075","182","2021-08-27T12:43:55Z","2025-05-16T10:27:46Z"
"TonyPhipps/SIEM","SIEM Tactics, Techiques, and Procedures","https://github.com/TonyPhipps/SIEM","PowerShell","627","105","2018-08-02T16:40:34Z","2025-05-12T14:27:13Z"
"stuhli/awesome-event-ids","Collection of Event ID ressources useful for Digital Forensics and Incident Response","https://github.com/stuhli/awesome-event-ids",,"614","86","2021-09-22T15:36:50Z","2025-05-17T16:23:16Z"
"TheHive-Project/Cortex","Cortex: a Powerful Observable Analysis and Active Response Engine","https://github.com/TheHive-Project/Cortex","Scala","1424","240","2017-01-10T10:52:57Z","2025-05-17T16:10:27Z"
"MBCProject/mbc-markdown","MBC content in markdown","https://github.com/MBCProject/mbc-markdown","JavaScript","444","49","2019-08-01T16:39:28Z","2025-05-16T15:20:57Z"
"sbousseaden/EVTX-ATTACK-SAMPLES","Windows Events Attack Samples","https://github.com/sbousseaden/EVTX-ATTACK-SAMPLES","HTML","2361","409","2019-03-15T08:45:44Z","2025-05-16T19:43:36Z"
"mdecrevoisier/EVTX-to-MITRE-Attack","Set of EVTX samples (>270) mapped to MITRE ATT&CK tactic and techniques to measure your SIEM coverage or developed new use cases.","https://github.com/mdecrevoisier/EVTX-to-MITRE-Attack",,"570","89","2020-07-09T19:27:39Z","2025-05-14T00:50:04Z"
"ocsf/ocsf-schema","OCSF Schema","https://github.com/ocsf/ocsf-schema",,"682","157","2022-04-16T04:55:08Z","2025-05-15T22:17:29Z"
"HuskyHacks/PMAT-labs","Labs for Practical Malware Analysis & Triage","https://github.com/HuskyHacks/PMAT-labs","HCL","972","226","2021-10-19T14:12:39Z","2025-05-17T20:42:30Z"
"PowerShell/PSReadLine","A bash inspired readline implementation for PowerShell","https://github.com/PowerShell/PSReadLine","C#","3943","312","2013-05-13T06:39:28Z","2025-05-17T16:13:23Z"
"p0dalirius/webapp-wordlists","This repository contains wordlists for each versions of common web applications and content management systems (CMS). Each version contains a wordlist of all the files directories for this version.","https://github.com/p0dalirius/webapp-wordlists","Python","517","117","2021-11-21T18:12:34Z","2025-05-16T03:25:08Z"
"p0dalirius/Awesome-RCE-techniques","Awesome list of step by step techniques  to achieve Remote Code Execution on various apps!","https://github.com/p0dalirius/Awesome-RCE-techniques","Dockerfile","1888","223","2022-04-05T06:49:03Z","2025-05-18T00:14:37Z"
"kyleavery/AceLdr","Cobalt Strike UDRL for memory scanner evasion.","https://github.com/kyleavery/AceLdr","C","935","163","2022-08-11T00:06:09Z","2025-05-18T07:26:06Z"
"trickster0/EDR_Detector","EDR Detector that can find what kind of endpoint solution is being used according to drivers in the system.","https://github.com/trickster0/EDR_Detector","Rust","94","14","2019-08-24T20:50:09Z","2025-04-23T15:43:08Z"
"trickster0/OffensiveRust","Rust Weaponization for Red Team Engagements.","https://github.com/trickster0/OffensiveRust","Rust","2836","320","2019-05-07T23:12:20Z","2025-05-18T01:41:29Z"
"microsoft/msticpy","Microsoft Threat Intelligence Security Tools","https://github.com/microsoft/msticpy","Python","1860","328","2019-02-21T17:30:03Z","2025-05-16T16:22:05Z"
"rootm0s/WinPwnage","UAC bypass, Elevate, Persistence methods","https://github.com/rootm0s/WinPwnage","Python","2680","385","2018-04-08T18:51:50Z","2025-05-17T13:14:44Z"
"paladin316/ThreatHunting","This repo is where I store my Threat Hunting ideas/content","https://github.com/paladin316/ThreatHunting",,"87","17","2021-11-20T14:40:43Z","2025-02-18T17:06:05Z"
"west-wind/Threat-Hunting-With-Splunk","Awesome Splunk SPL hunt queries that can be used to detect the latest vulnerability exploitation attempts & subsequent compromise","https://github.com/west-wind/Threat-Hunting-With-Splunk",,"63","8","2022-04-12T08:52:15Z","2025-04-30T08:02:34Z"
"inodee/threathunting-spl","Splunk code (SPL) for serious threat hunters and detection engineers.","https://github.com/inodee/threathunting-spl",,"276","40","2017-06-22T20:23:13Z","2025-04-21T16:31:38Z"
"mandiant/sunburst_countermeasures",,"https://github.com/mandiant/sunburst_countermeasures","YARA","560","201","2020-12-13T15:10:47Z","2025-04-21T19:24:49Z"
"mandiant/capa-rules","Standard collection of rules for capa: the tool for enumerating the capabilities of programs","https://github.com/mandiant/capa-rules",,"581","182","2020-06-18T21:19:56Z","2025-05-13T15:27:05Z"
"guardsight/gsvsoc_cirt-playbook-battle-cards","Cyber Incident Response Team Playbook Battle Cards","https://github.com/guardsight/gsvsoc_cirt-playbook-battle-cards",,"376","69","2019-10-27T04:28:00Z","2025-05-09T08:58:14Z"
"WiredPulse/PowerShell","A series of scripts","https://github.com/WiredPulse/PowerShell","PowerShell","98","30","2016-08-21T21:34:30Z","2024-11-22T13:47:22Z"
"microsoft/SysmonForLinux","Sysmon for Linux","https://github.com/microsoft/SysmonForLinux","C","1881","198","2020-10-28T17:30:25Z","2025-05-16T15:55:04Z"
"nshalabi/SysmonTools","Utilities for Sysmon","https://github.com/nshalabi/SysmonTools",,"1520","205","2017-06-10T19:58:08Z","2025-05-13T15:02:23Z"
"simsong/bulk_extractor","This is the development tree. Production downloads are at:","https://github.com/simsong/bulk_extractor","C++","1209","204","2012-04-03T04:36:41Z","2025-05-15T21:48:46Z"
"splunk/attack_data","A repository of curated datasets from various attacks","https://github.com/splunk/attack_data","Python","649","105","2020-07-21T20:16:23Z","2025-05-16T13:16:39Z"
"jschicht/UsnJrnl2Csv","Parser for $UsnJrnl on NTFS","https://github.com/jschicht/UsnJrnl2Csv","AutoIt","110","15","2014-02-19T21:51:27Z","2025-03-28T05:40:14Z"
"jschicht/ExtractUsnJrnl","Tool to extract the $UsnJrnl from an NTFS volume","https://github.com/jschicht/ExtractUsnJrnl","AutoIt","106","20","2014-09-10T20:56:42Z","2025-04-22T13:13:54Z"
"jschicht/RunAsTI","Launch processes with TrustedInstaller privilege","https://github.com/jschicht/RunAsTI","AutoIt","422","82","2014-08-15T19:41:11Z","2025-05-07T13:10:52Z"
"jschicht/LogFileParser","Parser for $LogFile on NTFS","https://github.com/jschicht/LogFileParser","AutoIt","194","28","2014-02-19T21:34:57Z","2025-05-14T10:33:21Z"
"jschicht/RawCopy","Commandline low level file extractor for NTFS","https://github.com/jschicht/RawCopy","AutoIt","286","39","2014-02-26T21:45:30Z","2025-05-16T11:26:01Z"
"jschicht/Mft2Csv","Extract $MFT record info and log it to a csv file.","https://github.com/jschicht/Mft2Csv","AutoIt","270","30","2014-01-24T00:10:50Z","2025-05-06T03:05:52Z"
"jschicht/Indx2Csv","An advanced  parser for INDX records","https://github.com/jschicht/Indx2Csv","AutoIt","27","4","2015-11-09T22:47:16Z","2024-10-28T02:32:02Z"
"williballenthin/INDXParse","Tool suite for inspecting NTFS artifacts.","https://github.com/williballenthin/INDXParse","Python","221","43","2011-09-04T02:26:52Z","2025-04-17T00:37:24Z"
"libyal/libvshadow","Library and tools to access the Volume Shadow Snapshot (VSS) format","https://github.com/libyal/libvshadow","C","111","28","2014-09-28T10:41:58Z","2024-12-20T11:59:21Z"
"Yaxser/Backstab","A tool to kill antimalware protected processes","https://github.com/Yaxser/Backstab","C","1444","243","2021-06-15T16:02:11Z","2025-05-16T06:47:34Z"
"sans-blue-team/sec555-wiki",,"https://github.com/sans-blue-team/sec555-wiki","HTML","77","32","2017-06-12T16:25:57Z","2024-10-10T05:12:52Z"
"log2timeline/plaso","Super timeline all the things","https://github.com/log2timeline/plaso","Python","1842","368","2014-09-08T23:29:28Z","2025-05-17T21:57:50Z"
"EricZimmerman/MFTECmd","Parses $MFT from NTFS file systems","https://github.com/EricZimmerman/MFTECmd","C#","238","46","2018-06-07T16:58:42Z","2025-05-06T04:47:31Z"
"de4dot/de4dot",".NET deobfuscator and unpacker.","https://github.com/de4dot/de4dot","C#","7144","2745","2011-09-20T01:50:28Z","2025-05-18T08:09:51Z"
"Yara-Rules/rules","Repository of yara rules","https://github.com/Yara-Rules/rules","YARA","4391","1020","2015-04-11T05:56:16Z","2025-05-17T20:46:13Z"
"ErrorNoInternet/FollinaScanner","A tool written in Go that scans files & directories for the Follina exploit (CVE-2022-30190)","https://github.com/ErrorNoInternet/FollinaScanner","Go","24","6","2022-06-02T06:45:19Z","2024-11-16T19:54:48Z"
"offsecginger/koadic","zerosum0x0's Koadic","https://github.com/offsecginger/koadic","Python","294","81","2022-01-03T01:05:43Z","2025-05-05T19:46:11Z"
"matonis/page_brute","Page File analysis tools.","https://github.com/matonis/page_brute","Python","127","23","2013-10-27T04:38:58Z","2025-04-20T11:44:07Z"
"YahooArchive/PyIOCe","Python IOC Editor","https://github.com/YahooArchive/PyIOCe","Python","63","10","2014-08-14T20:33:32Z","2025-05-02T14:41:57Z"
"hasherezade/hollows_hunter","Scans all running processes. Recognizes and dumps a variety of potentially malicious implants (replaced/implanted PEs, shellcodes, hooks, in-memory patches).","https://github.com/hasherezade/hollows_hunter","C","2156","272","2018-01-11T17:07:17Z","2025-05-17T16:17:26Z"
"aptnotes/data","APTnotes data","https://github.com/aptnotes/data",,"1708","283","2016-04-01T14:44:03Z","2025-05-12T07:05:46Z"
"hslatman/awesome-threat-intelligence","A curated list of Awesome Threat Intelligence resources","https://github.com/hslatman/awesome-threat-intelligence",,"8792","1561","2015-12-21T11:31:04Z","2025-05-17T16:07:12Z"
"fabacab/awesome-lockpicking",":unlock::sunglasses: A curated list of awesome guides, tools, and other resources related to the security and compromise of locks, safes, and keys.","https://github.com/fabacab/awesome-lockpicking",,"1598","115","2017-06-18T20:01:00Z","2025-05-17T17:36:26Z"
"magoo/redteam-plan","Issues to consider when planning a red team exercise.","https://github.com/magoo/redteam-plan",,"619","114","2017-08-22T19:57:29Z","2025-05-17T13:37:38Z"
"leechristensen/Random","Assorted scripts and one off things","https://github.com/leechristensen/Random","PowerShell","268","73","2015-11-19T04:58:23Z","2025-04-28T10:50:23Z"
"xorrior/Random-CSharpTools","Collection of CSharp Assemblies focused on Post-Exploitation Capabilities","https://github.com/xorrior/Random-CSharpTools","C#","228","71","2017-05-22T22:12:56Z","2025-04-17T08:31:25Z"
"bluscreenofjeff/Scripts","One-off scripts","https://github.com/bluscreenofjeff/Scripts","Shell","51","20","2015-05-14T01:36:06Z","2025-05-02T19:18:02Z"
"SadProcessor/SomeStuff","Some PowerShell Stuff","https://github.com/SadProcessor/SomeStuff","PowerShell","281","62","2017-03-19T15:17:42Z","2025-04-11T21:25:52Z"
"001SPARTaN/aggressor_scripts","A collection of useful scripts for Cobalt Strike","https://github.com/001SPARTaN/aggressor_scripts",,"170","24","2017-01-22T17:21:44Z","2025-04-17T00:42:10Z"
"bluscreenofjeff/AggressorScripts","Aggressor scripts for use with Cobalt Strike 3.0+","https://github.com/bluscreenofjeff/AggressorScripts",,"849","164","2016-04-13T08:16:12Z","2025-05-18T12:38:49Z"
"RhinoSecurityLabs/Aggressor-Scripts","Aggregation of Cobalt Strike's aggressor scripts.","https://github.com/RhinoSecurityLabs/Aggressor-Scripts","PowerShell","143","42","2018-03-31T18:39:08Z","2025-04-17T00:43:52Z"
"rasta-mouse/Aggressor-Script","Collection of Aggressor Scripts for Cobalt Strike","https://github.com/rasta-mouse/Aggressor-Script","PowerShell","171","48","2017-04-04T14:01:55Z","2025-05-03T11:29:41Z"
"harleyQu1nn/AggressorScripts","Collection of Aggressor scripts for Cobalt Strike 3.0+ pulled from multiple sources","https://github.com/harleyQu1nn/AggressorScripts","C#","1502","307","2017-04-21T12:14:35Z","2025-05-03T11:39:58Z"
"Und3rf10w/Aggressor-scripts","Aggressor scripts I've made for Cobalt Strike","https://github.com/Und3rf10w/Aggressor-scripts","PowerShell","407","91","2016-03-02T19:21:38Z","2025-03-25T10:09:56Z"
"secgroundzero/CS-Aggressor-Scripts","Aggressor Scripts for Cobalt Strike","https://github.com/secgroundzero/CS-Aggressor-Scripts","PowerShell","76","11","2018-03-10T20:01:18Z","2025-03-03T18:54:03Z"
"lorentzenman/sheepl","Sheepl : Creating realistic user behaviour for supporting tradecraft development within lab environments","https://github.com/lorentzenman/sheepl","Python","396","55","2018-09-15T08:57:48Z","2025-04-17T02:06:39Z"
"outflanknl/Invoke-ADLabDeployer","Automated deployment of Windows and Active Directory test lab networks. Useful for red and blue teams.","https://github.com/outflanknl/Invoke-ADLabDeployer","PowerShell","488","72","2018-03-30T11:01:36Z","2025-04-17T15:28:44Z"
"ubeeri/Invoke-UserSimulator","Simulates common user behaviour on local and remote Windows hosts.","https://github.com/ubeeri/Invoke-UserSimulator","PowerShell","282","38","2018-02-17T13:15:19Z","2025-03-10T15:47:47Z"
"jaredhaight/WindowsAttackAndDefenseLab",,"https://github.com/jaredhaight/WindowsAttackAndDefenseLab","PowerShell","169","28","2017-07-29T20:31:43Z","2025-04-17T00:42:50Z"
"tevora-threat/SharpView","C# implementation of harmj0y's PowerView","https://github.com/tevora-threat/SharpView","C#","1034","196","2018-07-24T21:15:04Z","2025-05-17T16:18:07Z"
"stufus/reconerator","C# Targeted Attack Reconnissance Tools","https://github.com/stufus/reconerator","C#","122","25","2018-07-25T10:19:41Z","2025-04-17T00:40:44Z"
"djhohnstein/SharpWeb",".NET 2.0 CLR project to retrieve saved browser credentials from Google Chrome, Mozilla Firefox and Microsoft Internet Explorer/Edge.","https://github.com/djhohnstein/SharpWeb","C#","526","103","2018-08-13T21:55:48Z","2025-05-16T01:40:56Z"
"cobbr/SharpSploit"," SharpSploit is a .NET post-exploitation library written in C#","https://github.com/cobbr/SharpSploit","C#","1799","311","2018-09-20T14:22:37Z","2025-05-13T20:48:41Z"
"SecurityRiskAdvisors/RedTeamSIEM","Repository of resources for configuring a Red Team SIEM using Elastic","https://github.com/SecurityRiskAdvisors/RedTeamSIEM","Shell","100","21","2018-06-22T12:53:38Z","2025-03-12T06:08:07Z"
"ztgrace/red_team_telemetry",,"https://github.com/ztgrace/red_team_telemetry","Python","98","36","2018-10-08T03:07:29Z","2025-03-31T03:24:45Z"
"vysecurity/CobaltSplunk","Splunk Dashboard for CobaltStrike logs","https://github.com/vysecurity/CobaltSplunk","Python","89","19","2018-05-18T17:11:19Z","2025-04-17T00:33:30Z"
"outflanknl/RedELK","Red Team's SIEM - tool for Red Teams used for tracking and alarming about Blue Team activities as well as better usability in long term operations.","https://github.com/outflanknl/RedELK","Python","2460","377","2018-10-03T15:55:05Z","2025-05-18T01:41:22Z"
"whid-injector/WHID","WiFi HID Injector - An USB Rubberducky / BadUSB On Steroids.","https://github.com/whid-injector/WHID","C++","1716","250","2017-03-07T08:58:57Z","2025-05-14T07:35:07Z"
"samyk/poisontap","Exploits locked/password protected computers over USB, drops persistent WebSocket-based backdoor, exposes internal router, and siphons cookies using Raspberry Pi Zero & Node.js.","https://github.com/samyk/poisontap","JavaScript","6347","997","2016-11-16T11:51:34Z","2025-05-18T01:36:26Z"
"Orange-Cyberdefense/fenrir-ocd",,"https://github.com/Orange-Cyberdefense/fenrir-ocd","Python","234","45","2017-06-15T07:37:19Z","2025-03-04T08:23:28Z"
"ebursztein/malusb","Malicious USB","https://github.com/ebursztein/malusb","C","171","34","2016-07-05T16:09:23Z","2025-04-05T11:13:06Z"
"RoganDawes/P4wnP1","P4wnP1 is a highly customizable USB attack platform, based on a low cost Raspberry Pi Zero or Raspberry Pi Zero W.","https://github.com/RoganDawes/P4wnP1","Python","4190","669","2017-02-22T14:34:09Z","2025-05-18T12:14:25Z"
"secgroundzero/warberry","WarBerryPi - Tactical Exploitation","https://github.com/secgroundzero/warberry","JavaScript","2222","289","2016-05-10T16:25:03Z","2025-05-12T03:32:58Z"
"samyk/magspoof","A portable device that can spoof/emulate any magnetic stripe, credit card or hotel card ""wirelessly"", even on standard magstripe (non-NFC/RFID) readers. It can disable Chip&PIN and predict AMEX card numbers with 100% accuracy.","https://github.com/samyk/magspoof","C","4010","611","2015-11-24T19:44:24Z","2025-05-17T16:15:10Z"
"sensepost/mana","*DEPRECATED* mana toolkit for wifi rogue AP attacks and MitM","https://github.com/sensepost/mana","HTML","1092","276","2014-08-10T01:21:57Z","2025-05-14T17:43:31Z"
"kgretzky/evilginx","PLEASE USE NEW VERSION: https://github.com/kgretzky/evilginx2","https://github.com/kgretzky/evilginx","Python","1161","269","2017-04-02T12:37:34Z","2025-05-18T07:11:40Z"
"Viralmaniar/Powershell-RAT","Python based backdoor that uses Gmail to exfiltrate data through attachment. This RAT will help during red team engagements to backdoor any Windows machines. It tracks the user activity using screen capture and sends it to an attacker as an e-mail attachment.","https://github.com/Viralmaniar/Powershell-RAT","Python","1119","240","2018-03-15T01:51:08Z","2025-05-16T13:37:10Z"
"wifiphisher/wifiphisher","The Rogue Access Point Framework","https://github.com/wifiphisher/wifiphisher","Python","13831","2647","2014-09-26T12:47:28Z","2025-05-18T11:08:59Z"
"ytisf/PyExfil","A Python Package for Data Exfiltration","https://github.com/ytisf/PyExfil","Python","782","141","2014-11-27T19:06:24Z","2025-05-17T16:14:18Z"
"Arno0x/DNSExfiltrator","Data exfiltration over DNS request covert channel","https://github.com/Arno0x/DNSExfiltrator","JavaScript","867","187","2017-12-20T13:58:09Z","2025-04-22T16:00:10Z"
"sensepost/DET","(extensible) Data Exfiltration Toolkit (DET)","https://github.com/sensepost/DET","Python","827","191","2016-02-29T15:34:56Z","2025-05-02T17:18:07Z"
"TryCatchHCF/Cloakify","CloakifyFactory - Data Exfiltration & Infiltration In Plain Sight; Convert any filetype into list of everyday strings, using Text-Based Steganography; Evade DLP/MLS Devices, Defeat Data Whitelisting Controls, Social Engineering of Analysts, Evade AV Detection","https://github.com/TryCatchHCF/Cloakify","Python","1601","233","2016-05-07T04:52:26Z","2025-05-17T16:15:36Z"
"0xbadjuju/Tokenvator","A tool to elevate privilege with Windows Tokens","https://github.com/0xbadjuju/Tokenvator","C#","1042","201","2017-12-08T01:29:11Z","2025-05-06T09:37:45Z"
"machosec/Mystique","PowerShell module to play with Kerberos S4U extensions","https://github.com/machosec/Mystique","PowerShell","52","14","2017-03-13T11:43:59Z","2025-04-10T08:01:48Z"
"l0ss/Grouper","A PowerShell script for helping to find vulnerable settings in AD Group Policy. (deprecated, use Grouper2 instead!)","https://github.com/l0ss/Grouper","PowerShell","739","119","2018-01-26T04:59:41Z","2025-03-03T18:54:01Z"
"wonderqs/Blade","A webshell connection tool with customized WAF bypass payloads","https://github.com/wonderqs/Blade","Python","125","29","2015-12-03T09:47:33Z","2025-03-03T18:53:46Z"
"sensepost/reGeorg","The successor to reDuh, pwn a bastion webserver and create SOCKS proxies through the DMZ. Pivot and pwn.","https://github.com/sensepost/reGeorg","Python","3082","826","2014-08-08T00:58:12Z","2025-05-17T08:45:07Z"
"SECFORCE/Tunna","Tunna is a set of tools which will wrap and tunnel any TCP communication over HTTP. It can be used to bypass network restrictions in fully firewalled environments. ","https://github.com/SECFORCE/Tunna","Python","1255","282","2014-11-24T16:31:41Z","2025-05-16T10:51:12Z"
"nccgroup/redsnarf","RedSnarf is a pen-testing / red-teaming tool for Windows environments","https://github.com/nccgroup/redsnarf","PowerShell","1215","239","2016-11-01T09:21:23Z","2025-05-18T01:48:42Z"
"codewhitesec/LethalHTA","Lateral Movement technique using DCOM and HTA","https://github.com/codewhitesec/LethalHTA","C#","233","45","2018-07-06T11:48:11Z","2025-04-25T01:10:11Z"
"DanMcInerney/icebreaker","Gets plaintext Active Directory credentials if you're on the internal network but outside the AD environment","https://github.com/DanMcInerney/icebreaker","PowerShell","1190","162","2017-12-04T03:42:28Z","2025-05-08T12:01:18Z"
"Arvanaghi/SessionGopher","SessionGopher is a PowerShell tool that uses WMI to extract saved session information for remote access tools such as WinSCP, PuTTY, SuperPuTTY, FileZilla, and Microsoft Remote Desktop. It can be run remotely or locally.","https://github.com/Arvanaghi/SessionGopher","PowerShell","1262","172","2017-03-08T02:49:32Z","2025-05-15T11:04:12Z"
"dirkjanm/BloodHound.py","A Python based ingestor for BloodHound","https://github.com/dirkjanm/BloodHound.py","Python","2110","347","2018-02-26T14:44:20Z","2025-05-18T06:11:45Z"
"SpecterOps/SharpHound","C# Data Collector for BloodHound","https://github.com/SpecterOps/SharpHound","C#","939","198","2021-07-12T17:07:04Z","2025-05-17T23:34:49Z"
"vysecurity/ANGRYPUPPY","Bloodhound Attack Path Automation in CobaltStrike","https://github.com/vysecurity/ANGRYPUPPY","PowerShell","316","86","2017-07-11T14:18:07Z","2025-04-17T00:38:52Z"
"coffeegist/cat-sites","Library of sites for categorization","https://github.com/coffeegist/cat-sites","Roff","26","5","2018-01-30T18:48:35Z","2025-05-08T12:01:18Z"
"SpiderLabs/DoHC2","DoHC2 allows the ExternalC2 library from Ryan Hanson (https://github.com/ryhanson/ExternalC2) to be leveraged for command and control (C2) via DNS over HTTPS (DoH).","https://github.com/SpiderLabs/DoHC2","C#","446","95","2018-10-23T19:40:23Z","2025-05-12T14:12:12Z"
"leoloobeek/keyserver","Easily serve HTTP and DNS keys for proper payload protection","https://github.com/leoloobeek/keyserver","Go","59","10","2018-09-30T21:04:35Z","2025-03-03T18:54:09Z"
"outflanknl/RedFile","Serving files with conditions, serverside keying and more.","https://github.com/outflanknl/RedFile","Python","18","4","2020-11-23T18:42:20Z","2025-04-17T00:34:30Z"
"violentlydave/mkhtaccess_red","Auto-generate an HTaccess for payload delivery -- automatically pulls ips/nets/etc from known sandbox companies/sources that have been seen before, and redirects them to a benign payload.","https://github.com/violentlydave/mkhtaccess_red","Shell","167","32","2018-08-21T17:24:31Z","2025-05-08T12:01:21Z"
"arlolra/meek","https://git.torproject.org/pluggable-transports/meek.git","https://github.com/arlolra/meek","Go","113","33","2014-02-20T09:48:58Z","2025-04-03T15:55:15Z"
"peewpw/DomainFrontDiscover","Scripts and results for finding domain frontable CloudFront domains","https://github.com/peewpw/DomainFrontDiscover","Python","54","14","2018-02-23T19:11:47Z","2025-03-03T18:54:02Z"
"redteam-cyberark/Google-Domain-fronting","Domain fronting using Google app engine","https://github.com/redteam-cyberark/Google-Domain-fronting","Python","52","21","2017-06-27T21:10:56Z","2025-04-07T21:40:27Z"
"taherio/redi","Automated script for setting up CobaltStrike redirectors (nginx reverse proxy, letsencrypt) ","https://github.com/taherio/redi","Shell","143","39","2016-09-29T06:16:16Z","2025-04-17T00:34:16Z"
"infosecn1nja/e2modrewrite","Convert Empire profiles to Apache mod_rewrite scripts","https://github.com/infosecn1nja/e2modrewrite","Python","28","21","2018-04-09T23:04:41Z","2025-05-04T05:21:35Z"
"ryhanson/ExternalC2","A library for integrating communication channels with the Cobalt Strike External C2 server","https://github.com/ryhanson/ExternalC2","C#","285","51","2017-11-14T06:13:55Z","2025-05-04T00:20:55Z"
"Und3rf10w/external_c2_framework","Python api for usage with cobalt strike's External C2 specification ","https://github.com/Und3rf10w/external_c2_framework","Python","236","97","2017-11-16T06:17:31Z","2025-04-27T12:23:39Z"
